id,usuario,categoria,contenido,tipo,visibilidad,fecha,ubicacion,estatus
0,65,7,"Hair back each little for player.
Traditional wind college situation to product. Office ahead tell.",texto,privado,1977-11-22 01:43:19,Josephmouth,activo
1,55,9,View pay prevent determine how. Believe eye anyone necessary run.,video,publico,2002-10-14 02:48:47,Elizabethstad,eliminado
2,87,4,"Writer bar perform style region simply what.
Degree itself fill town.",video,publico,2008-11-16 13:09:13,Collinschester,eliminado
3,65,10,Series response determine reflect maybe write campaign. Two collection Mr fine happen generation.,imagen,privado,2016-02-18 22:10:35,Williamsburgh,activo
4,33,9,House draw pick. Attack economic issue capital often.,imagen,publico,2018-01-20 00:03:14,West Juan,activo
5,31,9,Consumer center area word drug wrong forget. Popular note difference window sea prove serve.,video,privado,2000-12-26 18:29:23,West Dillonfurt,eliminado
6,18,7,Upon item effect have. Throw between Congress run office board structure.,video,publico,2012-06-14 10:59:34,West Regina,activo
7,96,10,Finally reveal size simply drop social. Probably safe memory. By care action owner.,imagen,privado,1996-07-05 12:59:00,Port Michellefort,eliminado
8,8,9,Speak speech special want lawyer know. Attorney of fish throughout doctor wait inside you.,texto,privado,1990-06-04 21:47:13,Sheilafort,activo
9,78,7,Investment know them other increase about. Something foot around bring.,video,privado,2022-09-09 04:59:26,New Anthonyton,eliminado
10,42,4,Nice eat station light now foreign. Style step week maintain.,imagen,publico,2016-05-16 06:07:39,Timothyside,activo
11,70,10,Owner lawyer product prevent soon believe. Difference laugh special plan mind.,texto,privado,1998-04-06 19:39:31,Cabreraville,eliminado
12,69,4,Every us cover finally. Place even trouble garden mention.,video,privado,2007-07-29 08:40:04,West Kevin,activo
13,16,7,Civil parent all any foreign artist. Establish build break.,video,publico,2019-08-07 11:19:01,Evansland,activo
14,42,3,Born movie more.,video,privado,1989-01-27 08:50:02,Klinehaven,eliminado
15,73,2,President modern standard young. Able only while realize everybody.,imagen,publico,1973-05-28 15:59:14,North Kristyborough,activo
16,83,6,Should try list fish guess not. Democrat do test heavy.,video,publico,2002-03-05 01:37:28,East Ashleyland,activo
17,35,2,Consumer important less. Third we product without country hand national. By official business if.,video,privado,2012-01-03 15:57:53,Ochoafort,eliminado
18,65,10,Animal news open college include check cell. Big court small along.,texto,privado,2016-02-19 18:52:18,North Stephanieville,activo
19,88,4,Church against rate. Physical reason role allow.,texto,privado,1975-06-25 21:31:39,New Travis,activo
20,55,6,Face note within box else. Republican create me until sit. National quickly term morning he.,imagen,publico,1983-02-06 19:09:31,Markmouth,activo
21,13,4,Life myself music very tax. Respond air white some.,imagen,privado,1976-05-08 15:52:48,West Amy,eliminado
22,59,6,End treatment draw business. Hundred form alone war edge whose name.,texto,privado,1971-02-04 08:02:14,Yatesburgh,eliminado
23,79,1,Truth available Mr really military military. Society forward color practice on effect Congress.,video,publico,2020-07-09 02:13:46,West Stephanie,eliminado
24,30,5,Knowledge other window into. Research provide reality society. Check treat successful address sea.,video,publico,2013-04-26 15:55:57,Nicolefurt,activo
25,13,9,Hear against action laugh serious. They smile pay option action.,imagen,privado,1975-01-20 12:44:13,North Karen,activo
26,87,7,Much method fill air. Race fear realize Congress. For peace agency day magazine.,imagen,privado,2017-12-19 13:56:54,West Kimberlyside,eliminado
27,95,10,Close back sell improve feel specific. Choose manage show go.,imagen,privado,2009-05-19 13:50:54,Lake Kathryn,activo
28,58,3,Change decade over speech many base. Story remain environment might rather.,video,privado,1983-09-18 15:34:18,Williamhaven,eliminado
29,57,4,Skin next style professional upon establish exactly.,video,privado,2019-10-13 09:38:02,South Angelshire,eliminado
30,72,3,Finally project decision media suddenly less security election. Throughout draw series.,texto,publico,2006-10-28 22:10:51,Port Victorport,activo
31,64,7,Image person another follow hit. Line structure born girl customer manage movie.,texto,privado,2015-12-12 01:07:37,South Nicole,eliminado
32,11,4,Before upon fire television. Station possible sport after past.,imagen,privado,1992-08-24 20:26:23,Mandyside,eliminado
33,39,1,Guy hard determine voice tend attorney.,texto,publico,1981-04-18 14:32:24,South Jacob,eliminado
34,40,3,Raise stay full too science somebody. Seat poor with become sometimes kind happen month.,video,privado,2001-10-25 23:44:16,Watsonburgh,eliminado
35,10,3,Continue Congress necessary system. Part four discuss spend employee.,video,privado,2024-12-09 21:41:21,Owensside,activo
36,42,5,Certainly line glass watch. Society design per information.,video,publico,2016-11-14 04:20:24,South Brittney,activo
37,15,8,Collection decision add government. Partner professional eat.,video,privado,2002-03-26 20:01:40,Walkerberg,activo
38,46,8,"Gas like establish.
Sort education center. Dream condition next process own.",texto,privado,1973-10-30 13:03:27,Port Andrea,activo
39,100,1,Building camera better organization article. Positive wear black blue line test.,imagen,privado,2009-05-03 02:05:54,East Amber,activo
40,10,4,Month center parent call family alone peace. Ask case daughter station gun. Fill assume religious.,video,publico,2012-01-17 22:15:19,East Jake,eliminado
41,39,7,Product mission line computer. Stage prepare building man. Artist success forward return executive.,texto,privado,2014-03-06 00:31:20,North Nancyview,eliminado
42,54,6,Line contain two image available enjoy. Sell later business first study minute anything.,video,privado,1992-11-20 01:55:46,Michaelview,activo
43,24,7,Green trial personal. Arrive glass during power fast summer including.,video,publico,1980-10-31 12:00:49,Williambury,eliminado
44,90,5,History movie nice may. Reveal identify floor.,video,publico,1997-08-05 12:15:59,North Samanthafurt,eliminado
45,68,3,Surface southern picture single southern away. Night join day sound special. Else live great.,video,privado,2021-08-21 08:38:37,Rhondaview,eliminado
46,64,2,Find arm year thus. Pick goal woman station west. Decision some miss now risk defense.,texto,publico,1981-08-24 14:31:57,Lake Haley,eliminado
47,64,8,Like arrive amount yes day. Air deal hair number ball significant. Cover single even.,imagen,publico,2003-01-25 01:56:30,West Felicia,eliminado
48,45,5,Right kid cover risk enter. Old south believe hour they stage wrong.,video,publico,2017-08-28 14:12:57,Jessicatown,eliminado
49,36,9,Scene decade popular wide story possible.,imagen,privado,2026-02-26 10:16:52,Pamelaborough,eliminado
50,38,7,Yeah represent risk participant hot. Service event issue race.,imagen,privado,1972-02-09 21:05:14,North Billy,activo
51,66,9,Read movie huge back.,video,publico,2000-06-03 11:27:32,East Erica,eliminado
52,39,8,Probably wrong land. Shoulder impact beat group age.,imagen,publico,2022-01-26 00:33:29,Angelabury,eliminado
53,57,3,Law home security difficult color open improve nothing. Former fear strategy about agent.,video,privado,2019-01-14 13:43:53,Port Justinburgh,eliminado
54,41,7,Similar require letter your guy. Person become born suffer.,video,publico,1970-08-08 00:29:59,Jasonport,activo
55,81,3,Between opportunity trial everything degree public. Behind interview worker product reason.,imagen,publico,1976-07-29 00:04:00,Danielsside,activo
56,26,1,Listen window including force attack impact look.,imagen,publico,2004-02-21 12:14:00,Lake Seantown,activo
57,61,4,Appear wife recognize wait series. Seven draw husband democratic both decide soon.,imagen,publico,1988-10-27 05:43:25,Johnstad,eliminado
58,49,2,As simply eat name. Deal second back art tonight. Budget easy place right address to.,texto,privado,2000-04-30 16:02:01,West Lisa,eliminado
59,56,3,Call when beyond southern teach score develop. Everybody not hour job.,video,privado,2018-08-14 22:09:25,Sonyaview,eliminado
60,12,1,Anyone drop phone space level. Including kid far.,imagen,privado,1982-09-04 23:53:00,Kramerbury,eliminado
61,49,10,Successful American reach politics along key their. Truth write student. Down any simple think.,texto,publico,1982-10-18 01:09:17,Vincentview,eliminado
62,70,3,Officer series computer certainly. Whether explain blue just mind data blood may.,imagen,privado,1991-09-26 19:45:47,New Stephenton,activo
63,97,5,Attack decade art can kind game community. Arrive Republican conference customer nor director.,video,privado,2007-03-13 12:53:30,Port Brandi,eliminado
64,20,3,Employee class early at. Everyone explain coach money risk. Center around find interest.,video,publico,1976-11-07 16:08:26,Powellborough,eliminado
65,43,3,Only team deep hand could center. Lose town share dream others second. Memory four wind care word.,video,privado,1971-09-15 03:08:31,Medinafurt,eliminado
66,99,9,And require policy. Certain box nature community size.,imagen,publico,2017-02-07 12:53:22,Brooksville,activo
67,22,6,Would continue data season. Wide people draw term issue indicate. Civil audience each form.,video,privado,2005-10-20 19:21:42,Port Craigburgh,eliminado
68,44,4,Home word however however. Good bank official family.,imagen,publico,2001-01-09 02:41:06,Weavermouth,activo
69,54,1,Drop coach occur push. These pay deep provide process near whole.,imagen,privado,1978-08-02 14:06:19,Lake Carolyn,eliminado
70,14,4,Movie his evening society view. Mean audience at thing include become simple.,imagen,privado,2025-10-01 05:32:28,West Latashaside,activo
71,100,3,Affect hot hotel house under. Instead early training remain then shake. Executive with wait how.,video,publico,2004-11-27 15:55:10,Lake Jack,activo
72,25,7,"Write stage forward.
Under left school property range body. Over gas reason film eat.",texto,publico,2000-05-27 07:47:28,Rickville,eliminado
73,2,4,Among school join today. Need stand so view man wear election. Report forget will cause without.,imagen,privado,2015-03-22 00:26:40,East Jeremy,eliminado
74,11,7,Natural move finish way PM medical think. Power paper guy tough.,imagen,publico,2007-03-30 03:38:13,Michaelstad,activo
75,37,3,As race though. Development western wall past. Deal development manager student walk.,imagen,privado,2025-02-10 18:14:17,North Deannachester,eliminado
76,43,2,During sea compare.,video,publico,2024-07-04 02:14:35,North Traceyhaven,eliminado
77,95,6,Enter perform work moment leader thousand. Show health court clear cell. Allow exist person.,video,privado,1972-01-09 12:44:44,Lisashire,eliminado
78,96,6,Include place offer help.,imagen,privado,2004-04-17 08:25:51,Sarahside,activo
79,9,4,Somebody agree protect trouble half style product.,video,privado,2001-07-09 21:11:17,East Gary,activo
80,8,5,Often student authority recently. That baby ago. Firm pressure see attention floor read leg piece.,video,publico,1997-09-09 03:43:51,Kennedytown,eliminado
81,54,10,Senior note choose involve word.,video,privado,2017-05-12 22:06:25,West Daniel,eliminado
82,17,7,Responsibility sense crime small per father. Bank employee nation visit.,imagen,privado,2015-04-02 03:47:30,Lake Jenniferbury,eliminado
83,2,7,Rule project trip gun manager. Child couple year read ready.,video,privado,2009-01-21 05:34:39,Randallton,activo
84,83,9,Thus adult benefit other. Enjoy add best.,video,publico,1976-10-28 12:29:47,Harrisonberg,eliminado
85,7,1,Where interview trade foreign possible hotel everybody. A go exactly page.,imagen,privado,2000-10-01 23:35:15,South Jamiebury,eliminado
86,18,3,Little police cold might outside goal to. Statement day interest ahead recognize TV.,video,privado,2008-11-21 17:24:26,Coreyshire,activo
87,77,6,Her likely very direction. Early after threat another key rock adult.,texto,privado,1996-11-01 19:00:30,Tannertown,activo
88,44,1,"Wrong condition draw door. Model yes see store.
Poor notice war.
Southern total treat able.",video,publico,2001-03-31 18:36:55,North Brian,eliminado
89,56,4,Marriage season technology or. Few spring character successful budget. Like represent voice.,imagen,privado,1995-01-20 02:00:40,South Joannaburgh,eliminado
90,81,9,Meeting inside best consider everyone government cost.,texto,privado,2004-09-12 23:12:54,Tracychester,eliminado
91,37,10,Clear data many home case respond. Myself start worry anything.,texto,publico,1977-04-20 07:17:06,Damonview,eliminado
92,32,1,Give girl sort there. Stop exactly big when building five. Remain on land worker.,imagen,publico,2001-02-01 03:14:39,Port Kaitlynmouth,eliminado
93,31,10,Word chance role she animal power break result. However much out name carry both board.,imagen,privado,1986-04-06 09:06:18,Chadbury,activo
94,45,4,Officer citizen they vote stock student sometimes.,imagen,privado,1989-05-23 00:35:53,Youngfurt,activo
95,52,10,Sort chance idea tree. Outside require assume show.,texto,privado,2008-05-30 08:06:34,Lake Amanda,eliminado
96,85,3,Campaign radio she area. Until week decide bag us discuss protect.,texto,publico,2015-02-24 02:01:16,Floresfort,activo
97,71,7,"Degree whether majority forget become fine. Thank cold rather.
Major social kid six.",imagen,publico,1999-02-09 18:46:14,Mcdanielview,eliminado
98,66,8,Stay election rule election century catch quite. Democrat food participant city.,video,privado,2021-07-30 23:58:59,Trevorside,activo
99,64,5,Lot notice candidate difficult director main political. Energy kid TV skin choice middle.,video,privado,2017-01-20 11:06:32,East Catherinefurt,eliminado
